,incident_name,incident_is_final,incident_date_last_update,incident_date_created,incident_administrative_unit,incident_administrative_unit_url,incident_county,incident_location,incident_acres_burned,incident_containment,incident_control,incident_cooperating_agencies,incident_longitude,incident_latitude,incident_type,incident_id,incident_url,incident_date_extinguished,incident_dateonly_extinguished,incident_dateonly_created,is_active,calfire_incident,notification_desired
1542,Honcut Fire,True,2020-06-20 19:14:48,2020-06-20 14:24:00,CALFIRE Butte Unit,,Butte,"Palermo Honcut Hwy and Four Junes Way, south of Palermo",89,100,,,-121.53976000000002,39.36894,Wildfire,a1959cb6-24e4-45e6-bcca-b792abe932ce,https://www.fire.ca.gov/incidents/2020/6/20/honcut-fire/,2020-06-20 19:14:00,2020-06-20,20200620,N,True,False
1543,East Fire,True,2020-06-21 09:57:32,2020-06-20 17:23:41,CALFIRE Lassen-Modoc Unit,,Modoc,County Road 79 and East 19th Street,11,100,Forward spread stopped,,-120.54161,41.5017,Wildfire,d7f02c71-a8b5-440a-b4a8-b8e011e214e3,https://www.fire.ca.gov/incidents/2020/6/20/east-fire/,,,20200620,N,True,False
1544,Quarter Fire,True,2020-07-07 14:35:05,2020-06-21 11:33:36,USFS Stanislaus National Forest,,Tuolumne,"Italian Bar Road and Grant Ridge Road, North of Twain Harte",10,100,,Stanislaus National Forest ,-120.20316000000001,38.082640000000005,Wildfire,641c7a44-b74a-4dce-bd7d-44078847003b,https://www.fire.ca.gov/incidents/2020/6/21/quarter-fire/,2020-07-07 14:34:00,2020-07-07,20200621,N,False,False
1545,Hunter Fire,True,2020-06-25 18:55:30,2020-06-21 16:29:28,CAL FIRE San Benito Unit ,,Monterey,"River Road and Interlake Road, South of Lockwood",195,100,,,-121.08753,35.90835,Wildfire,c50ced87-e83c-406c-b349-49cad87e680f,https://www.fire.ca.gov/incidents/2020/6/21/hunter-fire/,2020-06-25 18:55:00,2020-06-25,20200621,N,True,False
1546,Stage Fire,True,2020-06-22 19:12:25,2020-06-21 21:50:06,CAL FIRE San Benito Unit ,,Monterey,"  Old Stage Road and Williams Road, Northeast of Salinas",52,100,,,-121.57406999999999,36.69845,Wildfire,d0e31652-2b1e-4316-a1e0-c18ecb4ddbd7,https://www.fire.ca.gov/incidents/2020/6/21/stage-fire/,2020-06-22 19:12:00,2020-06-22,20200621,N,True,False
1547,Grade Fire ,True,2020-07-24 15:35:14,2020-06-22 08:16:27,CAL FIRE Tulare Unit,,Tulare,"Boyd Dr and Rd 168, east of Orosi",1050,100,,,-119.19677,36.5537,Wildfire,e7d05a34-0fdc-4db2-b713-0e10119d105d,https://www.fire.ca.gov/incidents/2020/6/22/grade-fire/,2020-06-26 06:39:00,2020-06-26,20200622,N,True,False
1548,Rico Fire ,True,2020-06-23 07:08:20,2020-06-22 15:55:55,CAL FIRE San Benito-Monterey Unit,,Monterey,"Sargents Canyon Rd and Dead Mans Gulch Rd, southeast of San Ardo",338,100,,,-120.87858,35.9789,Wildfire,cf392ebe-9c69-4a28-b52b-3772c06b493c,https://www.fire.ca.gov/incidents/2020/6/22/rico-fire/,2020-06-23 07:07:00,2020-06-23,20200622,N,True,False
1549,River Fire,True,2020-06-25 09:05:06,2020-06-22 13:55:00,,,San Luis Obispo,"River Road and Creston Road, West of Paso Robles",15,100,,Paso Robles Fire Department ,-120.68326,35.629059999999996,Wildfire,58e5665a-7aff-4f14-8ebe-490e73d3d37a,https://www.fire.ca.gov/incidents/2020/6/22/river-fire/,2020-06-23 09:04:00,2020-06-23,20200622,N,False,False
1550,Sycamore Fire,True,2020-06-26 18:04:12,2020-06-23 08:23:48,CAL FIRE Fresno County Fire,,Fresno,Sycamore Road and Coyote Drive Southeast of Tollhouse,19,100,,,-119.33438999999998,36.97511,Wildfire,c5071feb-80ec-4fbb-9d2f-eee1f1cea68a,https://www.fire.ca.gov/incidents/2020/6/23/sycamore-fire/,2020-06-26 18:04:00,2020-06-26,20200623,N,True,False
1551,R-2 Fire,True,2020-07-02 14:21:37,2020-06-23 21:12:11,Bureau of Land Management Northern California District,,Lassen,"Highway 395 and Smoke Creek Rod, Northeast of Susanville ",563,100,,Bureau of Land Management Northern California District ,-120.28147,40.43203,Wildfire,7d7f682a-0266-4758-93e6-795488af0687,https://www.fire.ca.gov/incidents/2020/6/23/r-2-fire/,2020-06-26 18:00:00,2020-06-26,20200623,N,False,False
1552,R-3 Fire,True,2020-07-02 14:22:13,2020-06-24 07:49:19,,,Lassen,Skedaddle Ranch Road and Spencer Basin Road Northeast of Herlong,210,100,,Bureau of Land Management Northern California District – Susanville,-120.04635,40.44793,Wildfire,54364494-e201-476a-8dc7-fbf2e0f94f60,https://www.fire.ca.gov/incidents/2020/6/24/r-3-fire/,2020-06-26 18:00:00,2020-06-26,20200624,N,False,False
1553,58 Fire,True,2020-06-29 07:00:24,2020-06-24 17:49:08,CAL FIRE Riverside County Fire ,,Riverside,"Van Buren Street and Avenue 58, Thermal",12,100,,CAL FIRE Riverside County Fire ,-115.96593999999999,33.27665,Wildfire,5b8b9b63-9cc6-4d55-9502-87009d75732c,https://www.fire.ca.gov/incidents/2020/6/24/58-fire/,2020-06-27 06:58:00,2020-06-27,20200624,N,True,False
1554,Diablo Fire,True,2020-06-26 18:32:50,2020-06-25 06:47:01,CAL FIRE Santa Clara Unit,,Stanislaus,Del Puerto Canyon and Diablo Grande,202,100,,,-121.18355,37.46265,Wildfire,64b9cf19-314a-4986-ae35-cf89f1f8bc2a,https://www.fire.ca.gov/incidents/2020/6/25/diablo-fire/,2020-06-26 18:32:00,2020-06-26,20200625,N,True,False
1555,Bend Fire,True,2020-06-29 07:06:13,2020-06-25 17:28:46,BLM California Central District,,San Luis Obispo,"Belmont Trail and Bend Rd, California Valley ",263,100,,BLM California Central District ,-119.88048,35.30742,Wildfire,d10cd103-f627-497d-a338-6430438ed7fb,https://www.fire.ca.gov/incidents/2020/6/25/bend-fire/,2020-06-28 07:06:00,2020-06-28,20200625,N,False,False
1556,Aurora Fire,True,2020-07-03 11:08:11,2020-06-26 15:13:24,BLM Central California District,,Mono,"Bodie Rd, east of Bridgeport",280,100,,BLM California Central District,-119.00289,38.22554,Wildfire,5b2b1489-ad5b-4104-b267-fdd61c0c48e9,https://www.fire.ca.gov/incidents/2020/6/26/aurora-fire/,2020-07-02 11:07:00,2020-07-02,20200626,N,False,False
1557,Indian Fire,True,2020-06-28 20:11:23,2020-06-26 17:07:51,CAL FIRE/Riverside County Fire Department,,Riverside,"Wheeler Rd and Tripp Flats Rd, community of Anza",59,100,,,-116.750925,33.565093,Wildfire,b13b3fea-fd2f-4c14-925b-63737df97f2e,https://www.fire.ca.gov/incidents/2020/6/26/indian-fire/,,,20200626,N,True,False
1558,Poeville Fire,True,2020-07-07 14:37:18,2020-06-27 19:08:50,Unified Command: USFS and Truckee Meadows Fire Protection District,,State of Nevada,Highway 395 Truckee Meadows ,2975,100,,Humboldt-Toiyabe National Forest,-119.81098,39.325959999999995,Wildfire,4db7101a-8097-4211-ab16-544f136dd35c,https://www.fire.ca.gov/incidents/2020/6/27/poeville-fire/,2020-07-06 14:36:00,2020-07-06,20200627,N,False,False
1559,Pass Fire,True,2020-07-03 07:34:59,2020-06-28 13:28:53,CAL FIRE Madera-Mariposa-Merced Unit,,Merced,"Hwy 152 and Dinosaur Point Rd, near Santa Nella",2192,100,,,-121.21911999999999,37.06641,Wildfire,a9397846-b830-4a42-a7e6-d2be9684a989,https://www.fire.ca.gov/incidents/2020/6/28/pass-fire/,2020-07-03 07:34:00,2020-07-03,20200628,N,True,False
1560,Gage Fire,True,2020-07-03 11:06:37,2020-06-28 15:58:46,CAL FIRE San Luis Obispo Unit,,San Luis Obispo,Running Deer Rd and Gage Irving Road,33,100,,,-120.96758999999999,35.69993,Wildfire,a6c54f7f-20f5-4c3b-a27b-745d7274def6,https://www.fire.ca.gov/incidents/2020/6/28/gage-fire/,2020-06-28 11:06:00,2020-06-28,20200628,N,True,False
1561,Muck Fire ,True,2020-06-29 18:49:13,2020-06-29 12:35:41,CAL FIRE Lassen- Modoc Unit ,,Lassen,"Highway 299 and Muck Valley Road, South of Nubieber ",12,100,,,-121.2199939,41.0336731,Wildfire,58a3d354-a532-440e-bfa8-aca414cf4cd0,https://www.fire.ca.gov/incidents/2020/6/29/muck-fire/,2020-06-29 18:49:00,2020-06-29,20200629,N,True,False
1562,Avacado Fire,True,2020-07-03 19:15:31,2020-06-30 15:43:01,CAL FIRE Butte Unit ,,Butte,"Bangor Park Road and Teddy Lane, West of Bangor  ",136,100,,,-121.4319,39.3784,Wildfire,fd24cc01-1057-4572-a83b-1775d49f42f7,https://www.fire.ca.gov/incidents/2020/6/30/avacado-fire/,2020-07-03 19:15:00,2020-07-03,20200630,N,True,False
1563,Flat Fire,True,2020-07-30 15:25:36,2020-06-30 17:40:16,Shasta Trinity National Forest,,Trinity,"Highway 299W and Mill Creek Road, Southeast of Burnt Ranch  ",62,100,,Shasta Trinity National Forest,-123.437051,40.791509000000005,Wildfire,49378c25-ecdb-406d-829b-755f2b248fcd,https://www.fire.ca.gov/incidents/2020/6/30/flat-fire/,2020-07-24 15:25:00,2020-07-24,20200630,N,False,False
1564,Bena Fire,True,2020-07-03 07:30:51,2020-07-01 16:32:50,Kern County Fire Department,,Kern,"Bena Road and Caliente Bodfish Road, East of Bakersfield",2900,100,,,-118.70273200000001,35.310132,Wildfire,14042a79-1fd0-4e82-b17d-1b201306de22,https://www.fire.ca.gov/incidents/2020/7/1/bena-fire/,2020-07-03 07:30:00,2020-07-03,20200701,N,True,False
1565,Rowher Fire,True,2020-08-13 10:43:47,2020-07-01 16:43:16,Angeles National Forest ,,Los Angeles,"Spring Canyon Road and Anthony Road, North of Santa Clarita ",648,100,,Angeles National Forest ,-118.324601,34.542742,Wildfire,ba60e1c4-d812-4b33-9a2e-b240a1b29408,https://www.fire.ca.gov/incidents/2020/7/1/rowher-fire/,2020-07-05 10:43:00,2020-07-05,20200701,N,False,False
1566,Bonadelle Fire,True,2020-07-03 07:33:57,2020-07-02 15:27:03,Madera County Fire Department,,Madera,"Avenue 15 and Road 35, Bonadelle",597,100,,,-119.9252132,36.967854200000005,Wildfire,f969420f-82a1-4edd-b7d3-28672e9d74b3,https://www.fire.ca.gov/incidents/2020/7/2/bonadelle-fire/,2020-07-03 07:33:00,2020-07-03,20200702,N,False,False
1567,Soda Fire ,True,2020-07-15 18:43:43,2020-07-03 14:00:40,BLM Central California District,,San Luis Obispo,"Soda Lake Rd and Culver City Rd, California Valley",157,100,,,-120.053275,35.393889,Wildfire,ac5dad8d-89f2-4f3f-b710-34661754ebb6,https://www.fire.ca.gov/incidents/2020/7/3/soda-fire/,2020-07-05 18:43:00,2020-07-05,20200703,N,False,False
1568,Mount R Fire,True,2020-07-06 13:27:32,2020-07-03 16:29:04,USFS San Bernardino National Forest,,San Bernardino,"Highway 330 and Old City Creek Road, Southwest of Running Springs",62,100,,USFS San Bernardino c,-117.124353,34.182435999999996,Wildfire,b564196f-6499-4e1e-b896-7b6211d97f90,https://www.fire.ca.gov/incidents/2020/7/3/mount-r-fire/,2020-07-06 13:27:00,2020-07-06,20200703,N,False,False
1569,Sheridan Fire,True,2020-07-05 18:48:49,2020-07-04 15:04:41,CAL FIRE Santa Clara Unit,,Alameda,"Sheridan Road, south of Sunol in Santa Clara county. ",108,100,,,-121.876277,37.536015,Wildfire,43289809-2636-4d90-8ed2-0012575d9e1d,https://www.fire.ca.gov/incidents/2020/7/4/sheridan-fire/,2020-07-05 18:47:00,2020-07-05,20200704,N,True,False
1570,Lake Fire,True,2020-07-05 19:40:57,2020-07-05 07:09:01,CAL FIRE San Luis Obispo Unit ,,San Luis Obispo,"Hwy 58 and Soda Lake Road, West of McKittrick",588,100,,,-120.00485,35.351065000000006,Wildfire,90f61641-f44c-4180-bb82-9238b1effeb7,https://www.fire.ca.gov/incidents/2020/7/5/lake-fire/,,,20200705,N,True,False
1571,Park Fire,True,2020-07-06 19:24:45,2020-07-05 07:13:22,CAL FIRE Santa Clara Unit ,,Santa Clara,"East Dunne Avenue and Finley Ridge Road, East of Morgan Hill",343,100,,,-121.56750500000001,37.166733,Wildfire,7f3042f1-3e76-4c3e-82c9-a0761c1c8b90,https://www.fire.ca.gov/incidents/2020/7/5/park-fire/,2020-07-06 19:23:00,2020-07-06,20200705,N,True,False
1572,Cotton Fire,True,2020-07-05 07:30:23,2020-07-05 07:30:23,CAL FIRE Madera-Mariposa-Merced Unit ,,Merced,"Hwy 152 and Lower Cottonwood Hunting Area, West of Santa Nella  ",100,100,,,-121.086625,37.091637,Wildfire,a7138f52-b933-4054-ae63-5f8e1e950be3,https://www.fire.ca.gov/incidents/2020/7/5/cotton-fire/,,,20200705,N,True,False
1573,Kings Fire,True,2020-07-07 18:49:16,2020-07-05 14:39:40,CAL FIRE Fresno Kings Unit,,Fresno,"King Canyon Road and Dunlap Road, East of Squaw Valley",67,100,,,-119.11653600000001,36.750186,Wildfire,cd2e7a3b-7b00-4da4-8612-a19a22c88fca,https://www.fire.ca.gov/incidents/2020/7/5/kings-fire/,,,20200705,N,True,False
1574,Crews Fire,True,2020-07-13 19:06:51,2020-07-05 14:55:49,CAL FIRE Santa Clara Unit ,,Santa Clara,"Crews Road and Oak Spring Circle, North of Gilroy",5513,100,,"Cooperating Agencies: Morgan Hill OES/EOC, Santa Clara County Sheriff, CalTrans, California Highway Patrol, CAL OES, PG&E, CALTRANS, CDCR, South County Fire Protection District, County Parks, California State Parks, Santa Clara Department of Public Health, Santa Clara Office of Emergency Management, Santa Clara Road Department, California Fish and Wildlife.",-121.50153200000001,37.034839,Wildfire,304a6ef7-53f6-4d2d-8d11-be431a7d75e8,https://www.fire.ca.gov/incidents/2020/7/5/crews-fire/,2020-07-13 19:06:00,2020-07-13,20200705,N,True,False
1575,Soledad Fire,True,2020-07-15 18:44:23,2020-07-05 17:18:35,Los Angeles County Fire Department and Angeles National Forest,,Los Angeles,"Soledad Canyon Road and Agua Dulce Canyon Rd, South of Agua Dulce ",1525,100,,USFS Angeles National Forest,-118.328877,34.467915000000005,Wildfire,2102ace4-f67b-4060-8795-f3cea12917e3,https://www.fire.ca.gov/incidents/2020/7/5/soledad-fire/,2020-07-10 18:44:00,2020-07-10,20200705,N,False,False
1576,California Fire,True,2020-07-08 07:07:14,2020-07-06 15:32:26,CAL FIRE Santa Clara Unit,,Contra Costa,California Street and Springwood Street. East of Rodeo,298,100,,,-122.25471,38.029959999999996,Wildfire,fc988bbb-4f93-478d-8a6c-b1be51d436c7,https://www.fire.ca.gov/incidents/2020/7/6/california-fire/,,,20200706,N,True,False
1577,Patterson Fire,True,2020-07-06 19:04:39,2020-07-06 16:04:20,CAL FIRE Santa Clara Unit,,San Joaquin,"Hwy 580 and Patterson Pass Rd, west of Tracy",150,100,,,-121.53523999999999,37.719840000000005,Wildfire,ce7dddd1-7a79-4aa4-b6bc-f4181aa2ac05,https://www.fire.ca.gov/incidents/2020/7/6/patterson-fire/,2020-07-06 19:02:00,2020-07-06,20200706,N,True,False
1578,Mountain Meadow Fire ,True,2020-07-28 11:50:34,2020-07-06 18:22:56,Cordelia Fire Protection District and Fairfield City Fire Department,,Solano,"Mountain Meadows Drive and Cedar Creek Court, Southwest of Fairfield",75,100,,Fairfield City Fire Department,-122.12447,38.21614,Wildfire,deaaf3fb-e0b2-4430-97cc-10d6d626df27,https://www.fire.ca.gov/incidents/2020/7/6/mountain-meadow-fire/,2020-07-09 11:50:00,2020-07-09,20200706,N,False,False
1579,Brandon Fire,True,2020-07-08 20:33:43,2020-07-07 16:06:21,CAL FIRE Amador-El Dorado Unit,,El Dorado, Brandon Rd,32,100,,"Cameron Park Fire Dept, Shingle Springs Rancheria Tribal Fire Dept, El Dorado Hills Fire Dept., Garden Valley Fire Protection Dist., Rescue Fire Protection Dist., Diamond Springs-El Dorado Fire Protection Dist., Bureau of Land Management, USFS, El Dorado County Sheriff’s Office, PG&E",-120.941267,38.58488,Wildfire,f398ee10-0c99-4096-be61-7c1611035ce1,https://www.fire.ca.gov/incidents/2020/7/7/brandon-fire/,,,20200707,N,True,False
1580,Nail Fire,True,2020-07-28 15:55:23,2020-07-07 17:32:13,USFS Mendocino National Forest,,Colusa,"Fouts Springs, Southwest of Stonyford",25,100,,USFS Mendocino National Forest,-122.65813,39.35498,Wildfire,a378ae17-9133-433f-8b63-23a1a7c6a4c6,https://www.fire.ca.gov/incidents/2020/7/7/nail-fire/,2020-07-09 15:20:00,2020-07-09,20200707,N,False,False
1581,Tripp Fire ,True,2020-07-11 07:44:38,2020-07-09 14:27:09,CAL FIRE / Riverside County Fire ,,Riverside,"Cary Road and Tripp Flats Road, West of Anza ",10,100,,CAL FIRE / Riverside County Fire ,-116.7464168,33.551838000000004,Wildfire,b4413d75-dc78-4810-9db3-c644a1afc5f3,https://www.fire.ca.gov/incidents/2020/7/9/tripp-fire/,2020-07-09 07:44:00,2020-07-09,20200709,N,True,False
1582,Alum Fire,True,2020-07-11 17:28:58,2020-07-11 10:50:33,Unified Command: CAL FIRE and San Jose Fire Department,,Santa Clara,"Mt Hamilton Rd and Crothers Rd, northeast of San Jose",31,100,,,-121.79348999999999,37.377309999999994,Wildfire,49be3366-f2b6-4ff5-8541-a25ad9bdc607,https://www.fire.ca.gov/incidents/2020/7/11/alum-fire/,2020-07-11 17:28:00,2020-07-11,20200711,N,True,False
1583,Power Fire,True,2020-07-15 19:09:02,2020-07-11 17:57:49,CAL FIRE Madera-Mariposa-Merced Unit,,Madera,"Road 222 and Road 235, South of North Fork",108,100,,"CAL FIRE, Madera County Sheriff’s Office, USFS, CHP, Madera County Roads, PG&E, North Fork Rancheria Mono Indians of California.",-119.50307,37.1487,Wildfire,1d6a3faf-2e35-4c7e-9efd-54339ad56ed6,https://www.fire.ca.gov/incidents/2020/7/11/power-fire/,2020-07-15 19:07:00,2020-07-15,20200711,N,True,False
1584,Elliot Fire,True,2020-07-15 18:45:16,2020-07-13 12:55:16,CALFIRE Riverside County Fire Unit,,Riverside,"Block Elliot Rd, south of  Winchester",2,100,,,-117.10842099999999,33.623968,Wildfire,2865a54c-f7c1-4595-b4b9-1c8082df22ce,https://www.fire.ca.gov/incidents/2020/7/13/elliot-fire/,2020-07-13 18:45:00,2020-07-13,20200713,N,True,False
1585,Robinson Fire,True,2020-07-15 19:11:29,2020-07-13 15:06:35,CAL FIRE Butte County Fire Unit,,Butte,"Gold Mountain Rd and Stoney Oaks Blvd, northeast of Bangor",33,100,,,-121.37993999999999,39.43227,Wildfire,dd705c7f-d18b-49a5-be60-c828d5c047fb,https://www.fire.ca.gov/incidents/2020/7/13/robinson-fire/,2020-07-15 19:09:00,2020-07-15,20200713,N,True,False
1586,Casino Fire,True,2020-07-16 07:11:10,2020-07-13 15:08:00,CALFIRE Riverside County Fire Unit/ USFS San Bernardino National Forest,,Riverside,"Hwy 371 and Santos Rd, south of Anza",91,100,Forward spread stopped.,,-116.83551999999999,33.48429,Wildfire,777f38a7-7d43-4641-998f-8524c692980c,https://www.fire.ca.gov/incidents/2020/7/13/casino-fire/,2020-07-15 07:07:00,2020-07-15,20200713,N,True,False
1587,Mineral Fire,True,2020-07-26 19:40:58,2020-07-13 16:40:36,CAL FIRE Fresno-Kings Unit,,Fresno,"Hwy 198 and S Coalinga Mineral Springs Rd, west of Coalinga",29667,100,,"Cooperating Agencies: California Highway Patrol, Bureau of Land Management, Fresno County Sheriff, Fresno County Office of Emergency Services, Coalinga City Fire, Coalinga Police and Public Works, California Conservation Corp, California Department of Corrections and Rehabilitation.",-120.52193,36.09493,Wildfire,ef5e4d08-bf3f-4df1-90b7-92e4e2a2fc91,https://www.fire.ca.gov/incidents/2020/7/13/mineral-fire/,2020-07-26 19:41:00,2020-07-26,20200713,N,True,False
1588,Coyote Fire,True,2020-07-18 07:36:18,2020-07-15 14:04:08,CAL FIRE San Benito- Monterey Unit ,,San Benito,"Panoche Road and Coyote Creek, West of Panoche",1508,100,,,-121.04401000000001,36.653,Wildfire,03459423-a538-4952-ba0c-c020face9151,https://www.fire.ca.gov/incidents/2020/7/15/coyote-fire/,2020-07-18 07:36:00,2020-07-18,20200715,N,True,False
1589,Ben Fire,True,2020-07-18 07:58:22,2020-07-15 16:44:16,CAL FIRE Madera-Mairposa-Merced Unit,,Mariposa,"Ben Hur Road and Buckeye Road, South of Mariposa  ",48,100,,,-119.95806999999999,37.423190000000005,Wildfire,79575aba-0ca4-446e-a28e-39bafbad368e,https://www.fire.ca.gov/incidents/2020/7/15/ben-fire/,2020-07-18 07:58:00,2020-07-18,20200715,N,True,False
1590,Valley Fire ,True,2020-07-15 19:12:02,2020-07-15 17:18:23,Department of Defense ,,Yuba,"Spenceville Road and Gandry Drive, Southeast of Beale Air Force base ",500,100,,,-121.33588999999999,39.10112,Wildfire,d268fd6c-a177-47b2-b13c-2ac26a02289e,https://www.fire.ca.gov/incidents/2020/7/15/valley-fire/,2020-07-15 19:11:00,2020-07-15,20200715,N,False,False
1591,Hollow Fire,True,2020-07-19 13:26:27,2020-07-16 18:14:18,CAL FIRE Santa Clara Unit,,Alameda,"Tesla Road and McLaughlin Road, Southeast of Livermore",253,100,,,-121.59374,37.640440000000005,Wildfire,a417d993-c3bf-4c5b-a01a-7d56a209a12d,https://www.fire.ca.gov/incidents/2020/7/16/hollow-fire/,2020-07-19 13:26:00,2020-07-19,20200716,N,True,False
1592,Pitzer Fire,True,2020-07-20 20:55:04,2020-07-17 14:59:54,CAL FIRE San Bernardino Unit,,San Bernardino,"Pitzer Buttes Road and Power line Road,  South of Lucerne Valley ",119,100,,,-116.97556999999999,34.39464,Wildfire,4035078f-8136-447e-8daf-3a63462a73d9,https://www.fire.ca.gov/incidents/2020/7/17/pitzer-fire/,2020-07-20 20:54:00,2020-07-20,20200717,N,True,False
1593,Badger Fire,True,2020-08-13 11:22:45,2020-07-18 17:18:20,CAL FIRE Siskiyou ,,Siskiyou,Badger Mountain Road and Hawkinsville Humbug Road,557,100,,,-122.69296000000001,41.79319,Wildfire,9520d0cb-1a4f-4dc0-bd38-967f5ee353f0,https://www.fire.ca.gov/incidents/2020/7/18/badger-fire/,2020-07-28 18:21:00,2020-07-28,20200718,N,True,False
1594,Hog Fire,True,2020-08-17 21:07:24,2020-07-18 17:28:18,CAL FIRE Lassen-Modoc Unit,,Lassen," Hog Flat Reservoir, West of Susanville",9564,100,,"Cooperating Agencies: Lassen National Forest, California Highway Patrol, Lassen County Sheriff, CALTRANS, County of Lassen, EMSA CAL-MAT, Susanville Police Department, CAL FIRE Lassen-Modoc Unit",-120.86375,40.420885999999996,Wildfire,fc0b7761-54a3-4275-a550-313d2b604f5e,https://www.fire.ca.gov/incidents/2020/7/18/hog-fire/,2020-08-17 21:07:00,2020-08-17,20200718,N,True,False
1595,Platina Fire,True,2020-07-27 19:20:54,2020-07-19 17:05:41,CAL FIRE Shasta-Trinity Unit,,Shasta,"Platina Rd and Big Foot Rd, southwest of Redding",340,100,,"Cooperating Agencies: Shasta County Fire Dept., Millville Fire Protection District, Happy Valley Fire Protection District, CDCR, AMR, California National Guard, California Conservation Corps",-122.792645,40.462621,Wildfire,c4d60e70-ee95-41f1-9e6e-4df4bdae3748,https://www.fire.ca.gov/incidents/2020/7/19/platina-fire/,2020-07-27 19:20:00,2020-07-27,20200719,N,True,False
1596,Gold Fire,True,2020-08-12 19:21:27,2020-07-20 14:12:25,Unified Command: CAL FIRE Lassen-Modoc Unit and BLM Northern CA District,,Lassen,"Highway 139 and County Road A-2, South of Adin",22634,100,,"Cooperating Agencies: California Department of Transportation, Modoc County Sheriff’s Office, California Highway Patrol, Lassen County Public Health, Shasta County Public Health, Surprise Valley Electric, California Conservation Corps, California Department of Corrections and Rehabilitation, Lassen County Office of Emergency Services, Lassen County Department of Public Works, Modoc County Office of Emergency Services, National Weather Service, Bureau of Land Management, Sierra Pacific Industries, CAL FIRE Lassen-Modoc Unit, BLM Northern CA District",-120.92329299999999,41.11037,Wildfire,9d4f56ae-b319-49b0-9a77-10088a2defda,https://www.fire.ca.gov/incidents/2020/7/20/gold-fire/,2020-08-12 19:21:00,2020-08-12,20200720,N,True,False
1597,Milepost 21 Fire,True,2020-08-18 18:09:57,2020-07-20 15:44:53,Hoopa Valley Indian Reservation,,Humboldt,"Highway 96 and Deerhorn Rd, southeast of Weitchpec",100,100,,Hoopa Valley Indian Reservation,-123.6986222,41.1849445,Wildfire,1c0e692a-8afc-41e9-8ac7-d27b977f0cdd,https://www.fire.ca.gov/incidents/2020/7/20/milepost-21-fire/,2020-08-18 18:09:00,2020-08-18,20200720,N,False,False
1598,Feather Fire,True,2020-07-22 14:40:34,2020-07-20 16:09:57,CAL FIRE/Butte County Fire Department,,Butte,"Feather Ave and 18th Street, Oroville",30,100,,,-121.604579,39.506597,Wildfire,64390cd6-42d4-4e9e-8dd9-1077f5191243,https://www.fire.ca.gov/incidents/2020/7/20/feather-fire/,2020-07-21 14:40:00,2020-07-21,20200720,N,True,False
1599,Holland Fire ,True,2020-07-29 11:20:47,2020-07-20 18:04:37,East Contra Costa Fire Protection District,,Contra Costa,"Delta Rd and Holland Tract Rd, northeast of Brentwood",75,100,,East Contra Costa Fire Protection District,-121.62023799999999,37.977309000000005,Wildfire,cac8f4bf-d269-4f13-b59c-07670b34f81f,https://www.fire.ca.gov/incidents/2020/7/20/holland-fire/,2020-07-20 11:20:00,2020-07-20,20200720,N,False,False
1600,Easton Fire,True,2020-08-04 16:01:51,2020-07-20 19:10:36,City of San Bernardino and San Bernardino National Forest   ,,San Bernardino,"Highway 330 and East Highland Avenue, Northeast of San Bernardino",71,100,,San Bernardino County Fire Department,-117.19214199999999,34.135626,Wildfire,f66fb4e4-cd4c-4410-9c00-43fed5882fb4,https://www.fire.ca.gov/incidents/2020/7/20/easton-fire/,2020-07-21 16:01:00,2020-07-21,20200720,N,False,False
1601,Rabbit Fire ,True,2020-07-21 07:19:09,2020-07-20 19:15:32,CAL FIRE Madera-Mariposa-Merced Unit ,,Madera,"Road 603 and Road 600, East of Chowchilla",135,100,,,-119.932391,37.118075,Wildfire,8146a328-05df-4b38-b11e-1c6fcedb1df7,https://www.fire.ca.gov/incidents/2020/7/20/rabbit-fire/,2020-07-21 07:18:00,2020-07-21,20200720,N,True,False
1602,Iris Fire,True,2020-08-12 16:38:04,2020-07-21 19:26:58,Inyo National Forest,,Mono,"Iris Meadow and Rock Creek Rd, South of Crowley Lake",120,100,,Inyo National Forest,-118.71113500000001,37.518879,Wildfire,1505ac89-a71c-4c77-9ae4-fb3eb34dbc66,https://www.fire.ca.gov/incidents/2020/7/21/iris-fire/,2020-08-12 16:37:00,2020-08-12,20200721,N,False,False
1603,July Complex,False,2020-08-13 10:54:18,2020-07-24 07:33:21,Modoc National Foresst ,,"Siskiyou, Modoc","Caldwell Trail and Hill Road, Northwest of Tionesta",0,0,,Modoc National Forest ,-121.477,41.699,Wildfire,c002a55a-95ef-4286-b358-daa8fd3ad086,https://www.fire.ca.gov/incidents/2020/7/24/july-complex/,,,20200724,N,False,False
1604,Jack Fire,True,2020-07-25 19:43:34,2020-07-24 17:32:36,CAL FIRE / Riverside County Fire ,,Riverside,"Hwy 60 and Jackrabbit Trail, West of Beaumont",145,100,,CAL FIRE / Riverside County Fire ,-117.033124,33.93327,Wildfire,22bb346a-660e-46cb-8c54-dbcda18fc4d6,https://www.fire.ca.gov/incidents/2020/7/24/jack-fire/,2020-07-25 19:42:00,2020-07-25,20200724,N,True,False
1605,Hill Fire,True,2020-07-25 07:09:24,2020-07-24 17:47:17,CAL FIRE Sonoma-Lake-Napa Unit ,,Colusa,"Highway 20 and Highway 16, East of Wilbur Springs",138,100,,,-122.35966299999998,39.013591,Wildfire,0364a8dd-0971-4f24-a020-6f4e97ccbace,https://www.fire.ca.gov/incidents/2020/7/24/hill-fire/,2020-07-25 07:07:00,2020-07-25,20200724,N,True,False
1606,Karen Fire,True,2020-08-01 07:23:51,2020-07-25 18:16:54,San Bernardino County Fire,,Riverside,Sierra Avenue and Karen Lane in Riverside County. ,250,100,,,-117.429598,34.028116,Wildfire,4d799b0d-240a-40fa-9ca7-f64aa1cd4002,https://www.fire.ca.gov/incidents/2020/7/25/karen-fire/,2020-07-28 07:21:00,2020-07-28,20200725,N,True,False
