,incident_name,incident_is_final,incident_date_last_update,incident_date_created,incident_administrative_unit,incident_administrative_unit_url,incident_county,incident_location,incident_acres_burned,incident_containment,incident_control,incident_cooperating_agencies,incident_longitude,incident_latitude,incident_type,incident_id,incident_url,incident_date_extinguished,incident_dateonly_extinguished,incident_dateonly_created,is_active,calfire_incident,notification_desired
1474,Grizzly Fire,True,2020-03-05 07:27:29,2020-03-02 14:08:05,CAL FIRE Tehama-Glenn Unit ,,Glenn,"Grizzly Flat Recreation Area, west of Orland",154,100,,,-122.38453200000001,39.774968,Wildfire,405d5f3f-66c9-4b69-8660-82780fa582b5,https://www.fire.ca.gov/incidents/2020/3/2/grizzly-fire/,2020-03-05 07:26:00,2020-03-05,20200302,N,True,False
1475,Mann Fire,True,2020-03-06 20:15:27,2020-03-03 11:13:50,CAL FIRE/ Riverside County Fire Department,,Riverside,"Santa Ana Riverbottom near California Ave and Grulla Ct,  South of Jurupa Valley ",180,100,,CAL FIRE/ Riverside County Fire Department,-117.51793,33.969570000000004,Wildfire,e1298aaa-1337-412e-ba09-7b29e87dad8b,https://www.fire.ca.gov/incidents/2020/3/3/mann-fire/,,,20200303,N,True,False
1476,Baker Fire,True,2020-03-18 10:48:19,2020-03-03 15:20:43,Tahoe National Forest,,Yuba,"Near Bullards Bar Reservoir, West of Camptonville ",0,0,,Tahoe National Forest ,-121.12381,39.45493,Wildfire,7411452c-1613-4e4f-afe6-865db0c476c4,https://www.fire.ca.gov/incidents/2020/3/3/baker-fire/,,,20200303,N,False,False
1477,South Main Fire,True,2020-03-09 11:20:45,2020-03-06 12:44:00,CAL FIRE / Riverside County Fire,,Riverside,"Off South Main Divide & Hacienda Rd, El Cariso",20,100,,,-117.40906000000001,33.65263,Wildfire,083f1638-4369-410f-9b57-d53cfaa938f7,https://www.fire.ca.gov/incidents/2020/3/6/south-main-fire/,,,20200306,N,True,False
1478,Carter Fire ,True,2020-04-20 13:51:38,2020-04-04 20:22:08,Imperial County Fire Departmant,,Imperial,"Off Austin Road  and Weaver Road, South of Brawley",275,100,,Imperial County Fire Departmant,-115.5865,32.93432,Wildfire,a87d4713-817a-47ac-9fa5-427c474cf9a5,https://www.fire.ca.gov/incidents/2020/4/4/carter-fire/,2020-04-12 13:51:00,2020-04-12,20200404,N,False,False
1479,Red Fire ,True,2020-04-26 09:53:40,2020-04-23 20:52:04,CAL FIRE Tehama-Glenn Unit,,Tehama,"Red Bank Road, Southwest of Red Bluff",26,100,,,-122.43905,40.09554,Wildfire,3eff88c0-89ee-4abe-8f6d-f74b90c42f30,https://www.fire.ca.gov/incidents/2020/4/23/red-fire/,2020-04-24 09:53:00,2020-04-24,20200423,N,True,False
1480,Bar Fire,True,2020-05-01 16:49:57,2020-04-25 14:59:00,CAL FIRE Shasta-Trinity Unit,,Trinity,Bar K Rd & Shady Creek Lane in Douglas City,55,100,,,-122.97693000000001,40.63442,Wildfire,4b1b0f5b-a4f9-4965-ad6a-029c9d89c68c,https://www.fire.ca.gov/incidents/2020/4/25/bar-fire/,,,20200425,N,True,False
1481,Byron Fire,True,2020-04-27 20:34:21,2020-04-27 14:59:04,Contra Costa Fire Protection District,,Contra Costa,"Byron Highway and Bruns Ave, southeast of Byron",47,100,,Contra Costa Fire Protection District,-121.595225,37.82066,Wildfire,18b88d88-2c76-41cb-9b07-5c9dda8f56d9,https://www.fire.ca.gov/incidents/2020/4/27/byron-fire/,2020-04-27 20:33:00,2020-04-27,20200427,N,False,False
1482,Interstate 5 Fire,True,2020-05-07 13:31:33,2020-05-03 15:52:04,Kings County Fire Department,,Kings,"Interstate 5 & Avenal Cutoff, south of Fresno County line",2060,100,,Kings County Fire Department,-120.106407,36.075003,Wildfire,2dac9fb4-1c2a-405a-93be-92ed7788a1d2,https://www.fire.ca.gov/incidents/2020/5/3/interstate-5-fire/,2020-05-03 13:31:00,2020-05-03,20200503,N,False,False
1483,Hollister Fire,True,2020-05-18 13:50:33,2020-05-07 08:10:19,Santa Barbara County Fire Department,,Santa Barbara,"Hollister Ranch, West of Goleta in Gaviota",156,100,Forward spread has stopped,Santa Barbara County Fire Department,-120.29378999999999,34.47438,Wildfire,d0dbf515-0e04-42d9-a46b-8ea21d18374a,https://www.fire.ca.gov/incidents/2020/5/7/hollister-fire/,2020-05-09 13:50:00,2020-05-09,20200507,N,False,False
1484,Candy Fire,True,2020-07-24 15:35:00,2020-05-08 14:46:20,CAL FIRE/Butte County Fire,,Butte,"Candy Cane Ln and Apache Hill Rd, west of Palermo",17,100,,CAL FIRE/Butte County Fire,-121.47273,39.42208,Wildfire,9a8425a9-f3ba-4afe-82d2-d9a9776959aa,https://www.fire.ca.gov/incidents/2020/5/8/candy-fire/,2020-05-08 15:21:00,2020-05-08,20200508,N,False,False
1485,Gilman Fire,True,2020-05-19 12:01:22,2020-05-18 13:38:14,CAL FIRE / Riverside County Fire ,,Riverside,"Gilman Springs Road and Slegers Street, Southeast of Moreno Valley",20,100,,CAL FIRE / Riverside County Fire ,-117.02411399999998,33.861053999999996,Wildfire,3788f0dd-0d61-4458-95a2-ebda03b815b2,https://www.fire.ca.gov/incidents/2020/5/18/gilman-fire/,2020-05-18 18:11:00,2020-05-18,20200518,N,True,False
1486,Acres Fire,True,2020-05-21 19:20:59,2020-05-21 11:30:00,CAL FIRE Madera-Mariposa-Merced Unit,,Madera,Near Road 602 and Road 603,152,100,,,-119.982359,37.11715,Wildfire,0fa5653a-c3c8-4aad-84ce-8d1dd74f211b,https://www.fire.ca.gov/incidents/2020/5/21/acres-fire/,,,20200521,N,False,False
1487,Spanish Fire ,True,2020-05-23 14:42:38,2020-05-22 15:27:09,CAL FIRE Sonoma Lake Napa Unit ,,Napa,"Spanish Valley Trail and Stagecoach Canyon, Northwest of Lake Berryessa",20,100,,,-122.40363400000001,38.697834,Wildfire,adbbc326-9f9a-434d-b18b-67a44f3906e5,https://www.fire.ca.gov/incidents/2020/5/22/spanish-fire/,2020-05-23 14:00:00,2020-05-23,20200522,N,False,False
1488,Range Fire,True,2020-05-28 08:23:28,2020-05-27 19:33:55,Department of Defense,,San Luis Obispo,Range M22 Camp Roberts Military Reserve,5000,100,"The Range Fire started May 27, 2020 near Range M22 Camp Roberts Military Reserve, north of San Luis Obispo in San Luis Obispo County.",Department of Defense,-120.70523999999999,35.34237,Wildfire,53d70cde-ef0f-49c1-80a9-dc306a8cc043,https://www.fire.ca.gov/incidents/2020/5/27/range-fire/,2020-05-28 06:45:00,2020-05-28,20200527,N,False,False
1489,Harley Fire,True,2020-05-28 21:18:24,2020-05-28 17:08:59,CAL FIRE / Riverside County Fire ,,Riverside,"19000 Block of Gustin Road, East of Lake Mathews",60,100,,,-117.34933999999998,33.83167,Wildfire,57f40970-22b5-4d75-a8f2-2482a18f5bca,https://www.fire.ca.gov/incidents/2020/5/28/harley-fire/,2020-05-28 20:30:00,2020-05-28,20200528,N,True,False
1490,Creek Fire,True,2020-05-30 18:06:45,2020-05-30 17:48:59,CAL FIRE Santa Clara Unit,,Contra Costa,"Round Valley Regional Park,  southwest of  Brentwood in Contra Costa County",60,50,,,-86.8616,35.9994,Wildfire,0e1e69d4-cb59-4228-8c55-f18e6b5ad71c,https://www.fire.ca.gov/incidents/2020/5/30/creek-fire/,,,20200530,N,True,False
1491,Scorpion Fire,True,2020-06-01 18:06:04,2020-05-31 18:09:09,,,Santa Barbara,Scorpion Valley on Santa Cruz Island in Santa Barbara county,1395,100,,Channel Islands National Park,-119.74577,34.01389,Wildfire,7a979a96-aeab-4afd-b55f-532882f36a6b,https://www.fire.ca.gov/incidents/2020/5/31/scorpion-fire/,,,20200531,N,False,False
1492,Acres Fire,True,2020-06-01 17:30:29,2020-06-01 15:29:05,CAL FIRE Madera-Mariposa-Merced Unit,,Madera,"Road 600 and Road 603,",237,100,,,-119.93221000000001,37.11806,Wildfire,8ad07f5d-c8eb-43c3-94d5-547ee9c0e5cd,https://www.fire.ca.gov/incidents/2020/6/1/acres-fire/,,,20200601,N,True,False
1493,Amoruso Fire,True,2020-06-01 16:44:41,2020-06-01 15:52:43,"Unified command: CAL FIRE, Placer County Fire Department and Placer County Sheriffs Office",,Placer,"Sunset Blvd West and Amoruso Way, southwest of Lincoln",650,100,,,-121.39086200000001,38.824371,Wildfire,a47ae21e-d488-4978-ade9-aeed0db63fa6,https://www.fire.ca.gov/incidents/2020/6/1/amoruso-fire/,,,20200601,N,True,False
1494,Nash Fire,True,2020-06-01 19:10:03,2020-06-01 17:41:59,CAL FIRE Mendocino Unit,,Mendocino,Nash Mill Rd and Big Meadow Rd,10,100,,,-123.48018,39.1296,Wildfire,0b723ec6-680d-464b-ba30-b444506ceb44,https://www.fire.ca.gov/incidents/2020/6/1/nash-fire/,,,20200601,N,False,False
1495,Horn Fire ,True,2020-06-02 18:33:56,2020-06-02 17:01:52,Northern California District - Susanville,,Lassen,"Horn Road and Mail Route Road, east of Ravendale in Lassen County. ",37,100,,,-120.288882,40.809323,Wildfire,0eca3343-e9f9-4d09-9fc3-95ab90b153ae,https://www.fire.ca.gov/incidents/2020/6/2/horn-fire/,2020-06-02 18:33:00,2020-06-02,20200602,N,False,False
1496,Smoketree Fire,True,2020-06-17 08:35:01,2020-06-02 19:38:16,City of Palm Springs City Fire/ California Desert District,,Riverside,East Murray Canyon Dr and S Toledo Ave,129,100,,,-116.524014,33.782532,Wildfire,94b147a7-68ac-4e60-ba42-81fce8facd30,https://www.fire.ca.gov/incidents/2020/6/2/smoketree-fire/,2020-06-07 08:34:00,2020-06-07,20200602,N,False,False
1497,Wildlife Fire,True,2020-06-10 09:27:21,2020-06-03 18:26:25,Suisun City Fire Department,,Solano,Kellogg St and Maple St,300,100,,,-122.042199,38.232281,Wildfire,2672d8d0-6523-40da-ae4e-6ae6d48e810a,https://www.fire.ca.gov/incidents/2020/6/3/wildlife-fire/,2020-06-04 09:26:00,2020-06-04,20200603,N,False,False
1498,Silver Fire,True,2020-06-04 17:37:30,2020-06-04 07:38:05,CAL FIRE Santa Clara Unit,,Santa Clara,"Dutch Flat Trail, East of San Jose",19,100,,,-121.726223,37.329163,Wildfire,0416a81f-0a17-4835-b05e-fe59a6e7379a,https://www.fire.ca.gov/incidents/2020/6/4/silver-fire/,,,20200604,N,False,False
1499,Brock Fire,True,2020-06-10 07:31:01,2020-06-04 16:36:17,U.S Forest Service - Shasta-Trinity National Forest,,Shasta,"Lake Shasta, West of Round Mountain",15,100,,,-122.09793300000001,40.837885,Wildfire,a5085c95-252d-4d1c-9e8a-6657a74b7ed5,https://www.fire.ca.gov/incidents/2020/6/4/brock-fire/,2020-06-04 07:30:00,2020-06-04,20200604,N,False,False
1500,Colleen Fire,True,2020-06-07 07:43:06,2020-06-04 19:36:47,Unified Command: CAL FIRE Santa Clara Unit and City of San Jose,,Santa Clara,"Colleen Dr, South San Jose",126,100,Evacuations in progress,City of San Jose,-121.851895,37.229703,Wildfire,3837f75a-208d-41d0-8d89-5719a11912ef,https://www.fire.ca.gov/incidents/2020/6/4/colleen-fire/,2020-06-07 07:42:00,2020-06-07,20200604,N,False,False
1501,Karchner Fire,True,2020-06-05 12:33:42,2020-06-05 09:04:00,CAL FIRE Nevada Yuba Placer Unit ,,Placer,"Karchner Road and Riosa Road, East of Wheatland",39,100,,,-121.340239,38.98487,Wildfire,57a6f6b7-eba1-4ed7-ba7b-6b078b06731d,https://www.fire.ca.gov/incidents/2020/6/5/karchner-fire/,2020-06-05 12:32:00,2020-06-05,20200605,N,True,False
1502,Lakeville Fire,True,2020-06-06 18:39:42,2020-06-05 16:56:55,CAL FIRE Sonoma Lake Napa Unit ,,Sonoma,"Lakeville Highway and Stage Gulch Road, Southeast of Petaluma",141,100,,,-122.54981599999999,38.224849,Wildfire,db5ad2e7-dc3d-41f2-91b4-4019857ee51e,https://www.fire.ca.gov/incidents/2020/6/5/lakeville-fire/,2020-06-06 18:37:00,2020-06-06,20200605,N,True,False
1503,McGary Fire ,True,2020-06-10 15:11:25,2020-06-05 17:09:00,Cordelia Fire Department,,Solano,"McGary Road and Highway 80, Southwest of Cordelia",79,100,,Cordelia Fire Department,-122.15631299999998,38.196892999999996,Wildfire,5698ae57-d61f-421b-8b75-623e9aa6debb,https://www.fire.ca.gov/incidents/2020/6/5/mcgary-fire/,2020-06-05 15:10:00,2020-06-05,20200605,N,False,False
1504,Gulch Fire,True,2020-06-08 18:33:16,2020-06-06 16:19:20,CAL FIRE Sonoma Lake Napa Unit ,,Sonoma,"Stage Gulch Road and  Lakeville Highway, North of Lakeville",107,100,,,-122.536406,38.216134000000004,Wildfire,e3e89516-4647-44bf-bd24-3293303f0776,https://www.fire.ca.gov/incidents/2020/6/6/gulch-fire/,2020-06-08 18:30:00,2020-06-08,20200606,N,True,False
1505,Quail Fire,True,2020-08-13 11:22:09,2020-06-06 16:36:26,CALFIRE Sonoma Lake Napa Unit ,,Solano,"Quail Canyon Road and Pleasants Valley Road, Southwest of Winters",1837,100,,"Cooperating Agencies: Vacaville City FD, Vacaville FPD, Montezuma FPD, Vallejo, Suisun City FD, Suisun FPD, Fairfield FP, Dixon FD, CDCR Vacaville, Cordelia FPD, Madison FPD, Winters FD Strike teams from: Contra Costa County, Marin County, San Francisco County",-122.03820800000001,38.470809,Wildfire,74b04a44-7cc1-4c8e-bd9e-9f3efa631df4,https://www.fire.ca.gov/incidents/2020/6/6/quail-fire/,2020-06-10 07:48:00,2020-06-10,20200606,N,True,False
1506,Willow Fire ,True,2020-06-07 07:55:42,2020-06-06 18:00:51,CALFIRE Santa Clara Unit ,,Contra Costa,"Willow Pass Court and Evora Road, Northeast of Concord",100,100,,,-122.00281100000001,37.994368,Wildfire,b5527f83-ebbe-4b09-a701-4b4fe6d37b45,https://www.fire.ca.gov/incidents/2020/6/6/willow-fire/,2020-06-07 07:52:00,2020-06-07,20200606,N,False,False
1507,Bitterwater Fire,True,2020-06-08 14:42:39,2020-06-07 14:43:51,CAL FIRE San Benito-Monterey,,Monterey,"off Bitterwater road, northeast of King City in Monterey County. ",211,100,,,-121.0781,36.2644,Wildfire,9247b89a-38f0-4e14-ac4a-59386cf867b4,https://www.fire.ca.gov/incidents/2020/6/7/bitterwater-fire/,,,20200607,N,True,False
1508,Hunters Fire,True,2020-06-10 07:03:48,2020-06-07 19:15:00,CAL FIRE Madera-Mariposa-Merced Unit,,Mariposa, Hunters Valley Road and Detwiler Road in Mariposa County. ,85,100,,,-120.21545400000001,37.61955,Wildfire,876b63ff-62a2-4584-8aa2-d99f027c0e9f,https://www.fire.ca.gov/incidents/2020/6/7/hunters-fire/,2020-06-10 07:03:00,2020-06-10,20200607,N,True,False
1509,Sperry Fire,True,2020-08-13 11:22:26,2020-06-08 13:55:53,CAL FIRE Santa Clara Unit ,,Stanislaus,"Diablo Grande Parkway and Del Puerto Canyon Road, West of Patterson",80,100,,,-121.16483000000001,37.463636,Wildfire,5a6e0c14-2906-4547-8024-e7b33071104b,https://www.fire.ca.gov/incidents/2020/6/8/sperry-fire/,2020-06-08 18:42:00,2020-06-08,20200608,N,True,False
1510,Grand Fire,True,2020-06-09 12:24:46,2020-06-08 15:45:17,CAL FIRE / Riverside County Fire ,,Riverside,"S Main Divide Road near DeCariso Road, West of Lake Elsinore ",27,100,,CAL FIRE / Riverside County Fire ,-117.37581000000002,33.638067,Wildfire,8a4b6636-55b6-4999-9de4-7b0cb22390a2,https://www.fire.ca.gov/incidents/2020/6/8/grand-fire/,2020-06-09 09:51:00,2020-06-09,20200608,N,True,False
1511,Bradley Fire ,True,2020-06-09 12:24:17,2020-06-08 16:16:07,CAL FIRE San Benito Monterey Unit ,,Monterey,"Sargents Canyon and Alvardo Road, North of Bradley",230,100,,,-120.81508999999998,35.94979,Wildfire,6b50bab1-7dcf-43c8-b4d1-afada595dd32,https://www.fire.ca.gov/incidents/2020/6/8/bradley-fire/,2020-06-09 12:24:00,2020-06-09,20200608,N,True,False
1512,Sierra Fire,True,2020-08-13 11:22:36,2020-06-08 17:46:04,Corona Fire Department,,Riverside, La Sierra Avenue and Cajalco Road,100,100,,Corona Fire Department,-117.46036000000001,33.82925,Wildfire,125e30fa-37fb-46ea-86ab-13058518aab6,https://www.fire.ca.gov/incidents/2020/6/8/sierra-fire/,2020-06-09 18:45:00,2020-06-09,20200608,N,False,False
1513,Oak Fire,True,2020-06-08 20:50:06,2020-06-08 20:50:06, CAL FIRE Riverside County Fire Department,,Riverside," 45000 Block of Castile Canyon Road, East of San Jacinto in Riverside County is 15 acres.",20,100,,,-116.89655,33.78275,Wildfire,fdd59b55-6aa2-442f-b788-e1291bb49cb1,https://www.fire.ca.gov/incidents/2020/6/8/oak-fire/,2020-06-08 20:46:00,2020-06-08,20200608,N,True,False
1514,Cronan Fire ,True,2020-06-10 18:11:53,2020-06-09 14:35:25,CAL FIRE Amador-El Dorado Unit,,El Dorado,"at Cronan Ranch off of Pedro Hill, near the community of Pilot Hill",29,100,,,-120.988571,38.827754999999996,Wildfire,d77e9eeb-a4ed-41b8-adff-9dd99aac5971,https://www.fire.ca.gov/incidents/2020/6/9/cronan-fire/,,,20200609,N,True,False
1515,Vineyard Fire ,True,2020-06-10 18:59:05,2020-06-09 15:22:55,CAL FIRE Mendocino Unit ,,Mendocino,"Highway 128 and Elkhorn Road, South of Yorkville",151,100,,"Cooperating Agencies: CAL FIRE, Anderson Valley Fire Department and Hopland Fire Protection District",-123.21318000000001,38.89695,Wildfire,dc1f8080-9c95-40e3-859b-71f6a080f05b,https://www.fire.ca.gov/incidents/2020/6/9/vineyard-fire/,2020-06-10 18:57:00,2020-06-10,20200609,N,True,False
1516,India Fire,True,2020-06-25 09:23:48,2020-06-09 21:51:40,Camp Pendleton,,San Diego,"Roblar Rd and Basilone Rd, Camp Pendleton Marine Corps Base",1100,100,,,-117.47166000000001,33.37579,Wildfire,21f49b4c-a5cd-4f17-90fd-b9f464b823c1,https://www.fire.ca.gov/incidents/2020/6/9/india-fire/,2020-06-12 09:23:00,2020-06-12,20200609,N,False,False
1517,Elizabeth Fire,True,2020-06-12 07:53:46,2020-06-10 13:11:26,Ventura County Fire Department,,Ventura,"Elizabeth and Foothill Rd, north of Ventura   ",289,100,Acreage change due to better mapping.,Ventura County Fire Department,-119.17808000000001,34.29475,Wildfire,c3c10b8f-a073-4ca6-bb7f-fdc57cf82b4c,https://www.fire.ca.gov/incidents/2020/6/10/elizabeth-fire/,2020-06-12 07:53:00,2020-06-12,20200610,N,False,False
1518,Soda Fire,True,2020-06-11 20:23:25,2020-06-10 14:52:42,CAL FIRE San Luis Obispo Unit,,San Luis Obispo,"Hwy 58 and Soda Lake Rd, California Valley",1672,100,,,-120.00521,35.351459999999996,Wildfire,3e6e0977-3563-442d-8bf3-d87c97b49880,https://www.fire.ca.gov/incidents/2020/6/10/soda-fire/,2020-06-11 20:23:00,2020-06-11,20200610,N,True,False
1519,Lime Fire,True,2020-06-17 13:43:05,2020-06-10 18:30:38,"Unified Command: CAL FIRE, Ventura County Fire Department and Las Padres National Forrest",,Ventura,"Lime Canyon Rd and Piru Canyon Rd, west of Lake Piru     ",803,100,,Ventura County Fire Department,-118.77346999999999,34.46182,Wildfire,4561c1c7-f447-4450-9ea8-f9717ee19f8d,https://www.fire.ca.gov/incidents/2020/6/10/lime-fire/,2020-06-17 13:42:00,2020-06-17,20200610,N,True,False
1520,Skyline Fire,True,2020-06-14 18:48:11,2020-06-11 13:08:40,CAL FIRE San Diego Unit,,San Diego,Skyline Truck Trail,100,100,Forward spread stopped. Evacuations Lifted,"Cooperating Agencies: SDSO, U.S. Forest Service ",-116.7862,32.73044,Wildfire,36e3b13b-c2d3-44f5-ba9f-23c1e9f73878,https://www.fire.ca.gov/incidents/2020/6/11/skyline-fire/,2020-06-14 18:47:00,2020-06-14,20200611,N,True,False
1521,Border 7 Fire,True,2020-06-13 18:00:48,2020-06-11 16:57:46,CAL FIRE San Diego Unit,,San Diego,Marron Valley,90,100,,,-116.690712,32.580882,Wildfire,203115aa-8ef9-436c-9d18-32613f9fa286,https://www.fire.ca.gov/incidents/2020/6/11/border-7-fire/,2020-06-13 18:00:00,2020-06-13,20200611,N,True,False
1522,Watt Fire,True,2020-06-11 20:51:28,2020-06-11 18:25:12,CAL FIRE Nevada-Yuba-Placer Unit,,Placer,PFE Rd and Watt Ave,40,100,Acreage change due to better mapping.,,-121.378879,38.733421,Wildfire,e86309b6-2223-4448-a7a2-bb83d4bc8352,https://www.fire.ca.gov/incidents/2020/6/11/watt-fire/,2020-06-11 20:46:00,2020-06-11,20200611,N,True,False
1523,Grant Fire,True,2020-06-17 08:11:28,2020-06-12 12:41:17,CAL FIRE Amador-El Dorado Unit,,Sacramento,Grantline Road and Keifer Blvd,5042,100,,"Sac Metro, Folsom FD, Cosumnes FD, USFS, Rescue FD, El Dorado Hills FPD, Cameron Park FD, Wilton FD, Bureau of Indian Affairs, Sac Sheriff’s Office, CHP, Rancho Cordova Police, Folsom Police, PG&E, SMUD",-121.201927,38.520981,Wildfire,86e91f38-4e2e-406f-ad97-5a3b47a9ce76,https://www.fire.ca.gov/incidents/2020/6/12/grant-fire/,2020-06-17 08:11:00,2020-06-17,20200612,N,True,False
1524,Hog Fire,True,2020-07-10 08:31:59,2020-06-12 17:35:38,USFS Sierra National Forest,,Fresno,E Trimmer Springs Rd and Pine Flat Lake ,533,100,,,-119.36572,36.822759999999995,Wildfire,50adb8e9-d672-49fa-95d0-657879169302,https://www.fire.ca.gov/incidents/2020/6/12/hog-fire/,2020-07-08 08:31:00,2020-07-08,20200612,N,False,False
1525,Cornetts Fire,True,2020-06-16 19:19:03,2020-06-13 14:27:51,CALFIRE Madera-Mariposa-Merced Unit,,Mariposa,Cornetts Road and Old Highway South,191,100,,,-120.08521999999999,37.40827,Wildfire,44bf7479-689e-4203-9f38-8b05917db66b,https://www.fire.ca.gov/incidents/2020/6/13/cornetts-fire/,2020-06-16 19:17:00,2020-06-16,20200613,N,True,False
1526,Dawson Fire ,True,2020-06-17 08:27:01,2020-06-13 18:32:06,CAL FIRE Riverside County Fire,,Riverside,Dawson Canyon Road and Park Canyon Road ,10,100,,,-117.461925,33.776033,Wildfire,90d7bf99-5b46-4a48-a07c-7468829e50b3,https://www.fire.ca.gov/incidents/2020/6/13/dawson-fire/,2020-06-13 08:26:00,2020-06-13,20200613,N,True,False
1527,Hopland Fire,True,2020-06-14 07:40:56,2020-06-13 18:52:54, CAL FIRE Mendocino Unit,,Mendocino,"Highway 101, southwest of Hopland",34,100,,,-80.49163,39.14783,Wildfire,2aa93d4d-809e-42ed-8025-7449711f667d,https://www.fire.ca.gov/incidents/2020/6/13/hopland-fire/,2020-06-14 07:36:00,2020-06-14,20200613,N,True,False
1528,Drum Fire,True,2020-06-16 19:22:38,2020-06-14 15:03:45,Lead agency: Santa Barbara County Fire,,Santa Barbara,"Drum Canyon Road and Highway 246, west of Buellton",696,100,,Santa Barbara County Fire,-120.28867,34.63309,Wildfire,b19c7e40-eac0-4c33-9414-590752f5c100,https://www.fire.ca.gov/incidents/2020/6/14/drum-fire/,,,20200614,N,False,False
1529,Avila Fire,True,2020-07-24 15:34:29,2020-06-15 16:44:39,CAL FIRE San Luis Obispo Unit ,,San Luis Obispo,"Avila Beach Drive and Hwy 101, East of Avila Beach",445,100,,,-120.69958999999999,35.17977,Wildfire,4382036a-3c19-479e-9a78-325007c1de3b,https://www.fire.ca.gov/incidents/2020/6/15/avila-fire/,2020-06-19 07:27:00,2020-06-19,20200615,N,True,False
1530,Bitter Fire ,True,2020-06-21 19:39:49,2020-06-16 14:11:55,CAL FIRE San Benito-Monterey Unit ,,San Benito,"Highway 25 and Hernandez-Coalinga Road, North of King City",895,100,,,-120.92925,36.3011,Wildfire,2190e4db-2b64-4d98-a5f9-00cc6221eec8,https://www.fire.ca.gov/incidents/2020/6/16/bitter-fire/,2020-06-21 19:27:00,2020-06-21,20200616,N,True,False
1531,Riata Fire ,True,2020-06-17 14:59:47,2020-06-16 14:44:53,CAL FIRE San Luis Obispo Unit,,San Luis Obispo,"5900 Block West Pozo Road near Hwy 58, East of Santa Margarita",18,100,,,-120.56823,35.40953,Wildfire,2250dea8-20a0-4e5e-b86e-bfe7821892c2,https://www.fire.ca.gov/incidents/2020/6/16/riata-fire/,2020-06-17 14:59:00,2020-06-17,20200616,N,True,False
1532,Walker Fire,True,2020-06-20 19:10:19,2020-06-16 16:58:00,CAL FIRE Tuolumne-Calaveras Unit,,Calaveras,"Walker Trail Road and Hogan Dam Road, North of Copperopolis",1455,100,,"Cooperating Agencies: Calaveras County Sheriffs Office, Altaville-Melones Fire, Calaveras Conlsolidated Fire, Central Calaveras Fire, San Andreas Fire, Copperopolis Fire, Stanislaus County Fire, San Joaquin County Fire, Modesto Fire, Jackson Fire, Linden-Peters Fire, Manteca Fire, Amador Fire, Lathrop Fire, Liberty Fire, Yocha Dehe Fire, UC Davis Fire, West Sacramento Fire, Sacramento Metro Fire, Sacramento City Fire, Consumnes Fire, Folsom Fire, LA County Fire, CAL OES, CA Dept. of Corrections ",-120.72958,38.07741,Wildfire,55a8e286-c088-45dc-8010-5c604dba3b69,https://www.fire.ca.gov/incidents/2020/6/16/walker-fire/,2020-06-20 19:10:00,2020-06-20,20200616,N,True,False
1533,Nelson Fire ,True,2020-06-17 19:22:36,2020-06-17 12:54:12,CAL FIRE/Butte County Fire Department,,Butte,"Nelson Ave and 16th St, Oroville",95,100,,Butte County Sheriff's Office,-121.60037,39.52408,Wildfire,fc3411f0-f9e0-4d0c-86a3-71afbac23f4a,https://www.fire.ca.gov/incidents/2020/6/17/nelson-fire/,2020-06-17 19:20:00,2020-06-17,20200617,N,True,False
1534,Liberty Fire,True,2020-06-18 10:44:50,2020-06-17 15:49:46,CAL FIRE Amador-El Dorado Unit,,San Joaquin,"Liberty Rd and Hwy 88, east of Galt",89,100,,"Cooperating Agencies: Buena Vista Rancheria Fire Dept., Clements Rural Fire Protection District., Liberty Rural County Fire Protection District, U.S. Forest Service, CHP, San Joaquin Sheriff’s Office, PG&E",-121.20828,38.234320000000004,Wildfire,7fc52805-21d4-4a56-b711-859d8c39e704,https://www.fire.ca.gov/incidents/2020/6/17/liberty-fire/,2020-06-18 10:44:00,2020-06-18,20200617,N,True,False
1535,Gyle Fire,True,2020-06-17 18:17:25,2020-06-17 16:39:25,CAL FIRE Tehama-Glenn Unit,,Tehama,"Interstate 5 and Gyle Road, north of Corning",68,100,,,-122.205628,40.000132,Wildfire,5a06793f-5f95-411b-9cce-b340ddd72061,https://www.fire.ca.gov/incidents/2020/6/17/gyle-fire/,,,20200617,N,True,False
1536,Ridge Fire,True,2020-06-25 09:07:34,2020-06-17 16:54:46,,,Monterey,"Plasket Ridge Road and S Coast Ridge Road, North of Gorda",83,100,,Los Padres National Forest ,-121.42113,35.9497,Wildfire,0cb8b199-ab94-42a5-a441-db7f272b170c,https://www.fire.ca.gov/incidents/2020/6/17/ridge-fire/,2020-06-22 09:07:00,2020-06-22,20200617,N,False,False
1537,Baker Fire,True,2020-06-18 19:34:33,2020-06-17 20:22:58,Kern County Fire Department,,Kern,"Bena Rd and Caliente Bodfish Rd, east of Bakersfield  ",165,100,,Kern County Fire Department,-118.6894,35.27678,Wildfire,c276a99a-8208-4402-b538-1e50aae50d63,https://www.fire.ca.gov/incidents/2020/6/17/baker-fire/,2020-06-18 19:17:00,2020-06-18,20200617,N,False,False
1538,Nelson Fire,True,2020-06-18 19:24:38,2020-06-18 16:56:59,CAL FIRE Nevada-Yuba-Placer Unit,,Placer,"Nelson Rd and Rockwell Ln, west of Lincoln",110,100,,,-121.33956,38.89178,Wildfire,2a79a833-693d-4dff-a199-c93b5a3ebe39,https://www.fire.ca.gov/incidents/2020/6/18/nelson-fire/,2020-06-18 19:24:00,2020-06-18,20200618,N,True,False
1539,Fork Fire,True,2020-07-24 15:34:43,2020-06-18 20:28:41,CAL FIRE Tulare Unit,,Tulare,"South Fork Dr and Salt Creek Fire Control Rd, East of Three Rivers",130,100,,,-118.845123,36.37085,Wildfire,0fc1bc5b-7ac5-4a2c-8048-9ed74623b838,https://www.fire.ca.gov/incidents/2020/6/18/fork-fire/,2020-06-22 19:26:00,2020-06-22,20200618,N,True,False
1540,Teddy Fire,True,2020-06-25 08:53:58,2020-06-18 22:33:51,CAL FIRE Butte Unit/Butte County Fire Department,,Butte,"Teddy Lane and Bangor Park Rd., Bangor",13,100,,,-121.45371999999999,39.37577,Wildfire,036cc8f1-ab4e-488c-8c46-86ebbb176d3e,https://www.fire.ca.gov/incidents/2020/6/18/teddy-fire/,2020-06-18 08:53:00,2020-06-18,20200618,N,True,False
1541,Springs Fire,True,2020-07-24 15:35:27,2020-06-19 15:19:44,CAL FIRE Tulare Unit,,Tulare,Hot Springs Dr and M-56,217,100,,,-118.8613,35.891329999999996,Wildfire,0413caad-a48e-447b-8ed8-1c8933360f21,https://www.fire.ca.gov/incidents/2020/6/19/springs-fire/,2020-06-22 19:22:00,2020-06-22,20200619,N,True,False
